{
  "schema": 1,
  "updated": "2026-10-11",
  "notes": "Curated for small local use. 'verified' = repo and quant confirmed to exist when this was written; exact file names are resolved from the repo tree via file_pattern at download time and pinned (commit + sha256) in the lock. Sampling presets follow each model card; MiniCPM5 needs min_p=0 (llama.cpp default 0.05 causes repetition).",
  "models": [
    {
      "id": "minicpm5-1b-fable5-v2-q8",
      "name": "MiniCPM5 1B · Opus-Fable5 V2",
      "family": "MiniCPM5",
      "params_b": 1.08,
      "quant": "Q8_0",
      "repo": "GnLOLot/MiniCPM5-1B-Claude-Opus-Fable5-V2-Thinking-GGUF",
      "revision": "main",
      "file": "MiniCPM5-1B-Claude-Opus-Fable5-V2-Thinking-Q8_0.gguf",
      "file_pattern": "(?i)Q8_0\\.gguf$",
      "approx_bytes": 1100000000,
      "license": "Apache-2.0 (base MiniCPM5-1B); fine-tune data licensing unclear: personal use",
      "context_max": 131072,
      "context_default": 8192,
      "capabilities": ["chat", "code", "thinking", "tools-xml", "long-context"],
      "supports_thinking_toggle": true,
      "sampling": {
        "no_think": { "temperature": 0.7, "top_p": 0.95, "min_p": 0.0 },
        "think": { "temperature": 0.9, "top_p": 0.95, "min_p": 0.0 }
      },
      "min_ram_gb": 8,
      "tier": "tiny",
      "tags": ["default", "fast", "thinking"],
      "isDefault": true,
      "verified": true,
      "why": "Default: tiny and fast, with better tool calling than V1. Community fine-tune of MiniCPM5-1B on Fable 5 traces.",
      "notes": "Community model by GnLOLot; the 'Claude-Opus-Fable5' name is the uploader's label, not an Anthropic release. V2 ships only Q8_0 and F16."
    },
    {
      "id": "minicpm5-1b-fable5-v1-q4",
      "name": "MiniCPM5 1B · Opus-Fable5 V1 (smallest)",
      "family": "MiniCPM5",
      "params_b": 1.08,
      "quant": "Q4_K_M",
      "repo": "GnLOLot/MiniCPM5-1B-Claude-Opus-Fable5-Thinking-GGUF",
      "revision": "main",
      "file": "MiniCPM5-1B-Claude-Opus-Fable5-Thinking-Q4_K_M.gguf",
      "file_pattern": "(?i)Q4_K_M\\.gguf$",
      "approx_bytes": 657000000,
      "license": "Apache-2.0 (base); fine-tune data licensing unclear: personal use",
      "context_max": 131072,
      "context_default": 8192,
      "capabilities": ["chat", "code", "thinking", "long-context"],
      "supports_thinking_toggle": true,
      "sampling": {
        "no_think": { "temperature": 0.7, "top_p": 0.95, "min_p": 0.0 },
        "think": { "temperature": 0.9, "top_p": 0.95, "min_p": 0.0 }
      },
      "min_ram_gb": 4,
      "tier": "tiny",
      "tags": ["smallest", "thinking"],
      "verified": true,
      "why": "Smallest footprint (657 MB). Good for old or 8 GB machines."
    },
    {
      "id": "minicpm5-1b-fable5-v1-q8",
      "name": "MiniCPM5 1B · Opus-Fable5 V1",
      "family": "MiniCPM5",
      "params_b": 1.08,
      "quant": "Q8_0",
      "repo": "GnLOLot/MiniCPM5-1B-Claude-Opus-Fable5-Thinking-GGUF",
      "revision": "main",
      "file": "MiniCPM5-1B-Claude-Opus-Fable5-Thinking-Q8_0.gguf",
      "file_pattern": "(?i)Q8_0\\.gguf$",
      "approx_bytes": 1100000000,
      "license": "Apache-2.0 (base); fine-tune data licensing unclear: personal use",
      "context_max": 131072,
      "context_default": 8192,
      "capabilities": ["chat", "code", "thinking", "long-context"],
      "supports_thinking_toggle": true,
      "sampling": {
        "no_think": { "temperature": 0.7, "top_p": 0.95, "min_p": 0.0 },
        "think": { "temperature": 0.9, "top_p": 0.95, "min_p": 0.0 }
      },
      "min_ram_gb": 8,
      "tier": "tiny",
      "tags": ["thinking"],
      "verified": true,
      "why": "V1 at near-lossless quality (Q8_0), for comparison with V2."
    },
    {
      "id": "minicpm5-1b-q8",
      "name": "MiniCPM5 1B (official)",
      "family": "MiniCPM5",
      "params_b": 1.08,
      "quant": "Q8_0",
      "repo": "openbmb/MiniCPM5-1B-GGUF",
      "revision": "main",
      "file": "MiniCPM5-1B-Q8_0.gguf",
      "file_pattern": "(?i)MiniCPM5-1B-Q8_0\\.gguf$",
      "approx_bytes": 1100000000,
      "license": "Apache-2.0",
      "context_max": 131072,
      "context_default": 8192,
      "capabilities": ["chat", "code", "thinking", "tools-xml", "long-context"],
      "supports_thinking_toggle": true,
      "sampling": {
        "no_think": { "temperature": 0.7, "top_p": 0.95, "min_p": 0.0 },
        "think": { "temperature": 0.9, "top_p": 0.95, "min_p": 0.0 }
      },
      "min_ram_gb": 8,
      "tier": "tiny",
      "tags": ["official", "clean-license"],
      "verified": true,
      "why": "The official OpenBMB base, with a clean Apache-2.0 license. The safest fallback."
    },
    {
      "id": "minicpm5-1b-q4",
      "name": "MiniCPM5 1B (official, small)",
      "family": "MiniCPM5",
      "params_b": 1.08,
      "quant": "Q4_K_M",
      "repo": "openbmb/MiniCPM5-1B-GGUF",
      "revision": "main",
      "file": "MiniCPM5-1B-Q4_K_M.gguf",
      "file_pattern": "(?i)MiniCPM5-1B-Q4_K_M\\.gguf$",
      "approx_bytes": 657000000,
      "license": "Apache-2.0",
      "context_max": 131072,
      "context_default": 8192,
      "capabilities": ["chat", "code", "thinking", "long-context"],
      "supports_thinking_toggle": true,
      "sampling": {
        "no_think": { "temperature": 0.7, "top_p": 0.95, "min_p": 0.0 },
        "think": { "temperature": 0.9, "top_p": 0.95, "min_p": 0.0 }
      },
      "min_ram_gb": 4,
      "tier": "tiny",
      "tags": ["official", "smallest"],
      "verified": true,
      "why": "Official 1B at 657 MB."
    },
    {
      "id": "minicpm5-2b-q4",
      "name": "MiniCPM5 2B",
      "family": "MiniCPM5",
      "params_b": 2.52,
      "quant": "Q4_K_M",
      "repo": "openbmb/MiniCPM5-2B-GGUF",
      "revision": "main",
      "file": "MiniCPM5-2B-Q4_K_M.gguf",
      "file_pattern": "(?i)MiniCPM5-2B-Q4_K_M\\.gguf$",
      "approx_bytes": 1560000000,
      "license": "Apache-2.0",
      "context_max": 131072,
      "context_default": 8192,
      "capabilities": ["chat", "code", "thinking", "tools-xml", "long-context"],
      "supports_thinking_toggle": true,
      "sampling": {
        "no_think": { "temperature": 0.8, "top_p": 0.95, "min_p": 0.0, "repeat_penalty": 1.05 },
        "think": { "temperature": 1.0, "top_p": 0.95, "min_p": 0.0 }
      },
      "min_ram_gb": 8,
      "tier": "small",
      "tags": ["official", "tools", "step-up"],
      "verified": true,
      "why": "The step-up for Rename Forge proposals and tool use. Designed for tool-use workflows.",
      "notes": "OpenBMB recommends temperature 1.0, top_p 0.95, min_p 0.0 (+ repetition_penalty 1.05 if repeating). The no_think preset is our conservative choice; verify with spike S1."
    },
    {
      "id": "minicpm5-2b-q8",
      "name": "MiniCPM5 2B (high quality)",
      "family": "MiniCPM5",
      "params_b": 2.52,
      "quant": "Q8_0",
      "repo": "openbmb/MiniCPM5-2B-GGUF",
      "revision": "main",
      "file": "MiniCPM5-2B-Q8_0.gguf",
      "file_pattern": "(?i)MiniCPM5-2B-Q8_0\\.gguf$",
      "approx_bytes": 2680000000,
      "license": "Apache-2.0",
      "context_max": 131072,
      "context_default": 8192,
      "capabilities": ["chat", "code", "thinking", "tools-xml", "long-context"],
      "supports_thinking_toggle": true,
      "sampling": {
        "no_think": { "temperature": 0.8, "top_p": 0.95, "min_p": 0.0, "repeat_penalty": 1.05 },
        "think": { "temperature": 1.0, "top_p": 0.95, "min_p": 0.0 }
      },
      "min_ram_gb": 16,
      "tier": "small",
      "tags": ["official", "quality"],
      "verified": true,
      "why": "Near-lossless 2B for machines with 16 GB or more."
    },
    {
      "id": "qwen3.5-4b-q4",
      "name": "Qwen3.5 4B",
      "family": "Qwen3.5",
      "params_b": 4.0,
      "quant": "Q4_K_M",
      "repo": "bartowski/Qwen_Qwen3.5-4B-GGUF",
      "revision": "main",
      "file_pattern": "(?i)Qwen3\\.5-4B-Q4_K_M\\.gguf$",
      "approx_bytes": 2800000000,
      "license": "Apache-2.0",
      "context_max": 262144,
      "context_default": 8192,
      "capabilities": ["chat", "code", "thinking", "tools-native", "multilingual", "long-context"],
      "supports_thinking_toggle": true,
      "sampling": {
        "no_think": { "temperature": 0.7, "top_p": 0.8, "top_k": 20, "min_p": 0.0 },
        "think": { "temperature": 0.6, "top_p": 0.95, "top_k": 20, "min_p": 0.0 }
      },
      "min_ram_gb": 8,
      "tier": "small",
      "tags": ["tools", "best-small", "multilingual"],
      "verified": true,
      "why": "The strongest small tool-caller (BFCL/TAU2-leading at 4B). Pick it for router-heavy work.",
      "notes": "Community imatrix quants by bartowski. Sampling follows Qwen3 guidance; check the Qwen3.5 card. Requires a 2026 llama.cpp (b11552 is fine). Thinking is on by default."
    },
    {
      "id": "qwen3.5-2b-q4",
      "name": "Qwen3.5 2B",
      "family": "Qwen3.5",
      "params_b": 2.0,
      "quant": "Q4_K_M",
      "repo": "bartowski/Qwen_Qwen3.5-2B-GGUF",
      "revision": "main",
      "file_pattern": "(?i)Qwen3\\.5-2B-Q4_K_M\\.gguf$",
      "approx_bytes": 1400000000,
      "license": "Apache-2.0",
      "context_max": 262144,
      "context_default": 8192,
      "capabilities": ["chat", "code", "thinking", "tools-native", "multilingual"],
      "supports_thinking_toggle": true,
      "sampling": {
        "no_think": { "temperature": 0.7, "top_p": 0.8, "top_k": 20, "min_p": 0.0 },
        "think": { "temperature": 0.6, "top_p": 0.95, "top_k": 20, "min_p": 0.0 }
      },
      "min_ram_gb": 8,
      "tier": "small",
      "tags": ["tools", "multilingual"],
      "verified": false,
      "why": "A balanced 2B with native tool calling.",
      "notes": "Repo name assumed from bartowski's naming. Use Search HF in the app to find the current uploader if it fails."
    },
    {
      "id": "gemma-4-e4b-q4",
      "name": "Gemma 4 E4B",
      "family": "Gemma 4",
      "params_b": 4.0,
      "quant": "Q4_K_M",